<xsd:schema attributeFormDefault="unqualified" elementFormDefault="qualified" version="1.0" xmlns:xsd="http://www.w3.org/2001/XMLSchema">
  <xsd:element name="exria-module">
    <xsd:complexType>
      <xsd:sequence>
        <xsd:element maxOccurs="unbounded" name="module">
          <xsd:complexType>
            <xsd:sequence>
              <xsd:element maxOccurs="unbounded" name="file">
                <xsd:complexType>
                  <xsd:attribute name="path" type="xsd:string" />
                  <xsd:attribute name="version" type="xsd:string" />
                  <xsd:attribute name="description" type="xsd:string" />
                </xsd:complexType>
              </xsd:element>
            </xsd:sequence>
            <xsd:attribute name="name" type="xsd:string" />
            <xsd:attribute name="description" type="xsd:string" />
          </xsd:complexType>
        </xsd:element>
      </xsd:sequence>
      <xsd:attribute name="name" type="xsd:string" />
    </xsd:complexType>
  </xsd:element>
</xsd:schema>